<?xml version="1.0"?>

<!DOCTYPE flatzinc SYSTEM "flatzinc.dtd">

<flatzinc model="./minizinc-1.0.2/fzn/bidb03_03_01">

<var_decl>
  <type>
    <int/>
  </type>
  <id name="b"/>
  <expr>
    <int_lit value="1"/>
  </expr>
</var_decl>

<var_decl>
  <type>
    <array>
      <int_lit value="9"/>
      <var>
        <bool/>
      </var>
    </array>
  </type>
  <id name="c"/>
  <annotation name="output_array">
    <expr>
      <array_lit>
        <set_lit>
          <int_range lo="1" hi="3"/>
        </set_lit>
        <set_lit>
          <int_range lo="1" hi="3"/>
        </set_lit>
        <set_lit>
          <int_lit value="1"/>
        </set_lit>
      </array_lit>
    </expr>
  </annotation>
</var_decl>

<var_decl>
  <type>
    <int/>
  </type>
  <id name="k"/>
  <expr>
    <int_lit value="3"/>
  </expr>
</var_decl>

<var_decl>
  <type>
    <int/>
  </type>
  <id name="lambda"/>
  <expr>
    <int_lit value="1"/>
  </expr>
</var_decl>

<var_decl>
  <type>
    <array>
      <int_lit value="3"/>
      <var>
        <bool/>
      </var>
    </array>
  </type>
  <id name="m"/>
  <annotation name="output_array">
    <expr>
      <array_lit>
        <set_lit>
          <int_range lo="1" hi="3"/>
        </set_lit>
        <set_lit>
          <int_lit value="1"/>
        </set_lit>
      </array_lit>
    </expr>
  </annotation>
</var_decl>

<var_decl>
  <type>
    <int/>
  </type>
  <id name="r"/>
  <expr>
    <int_lit value="1"/>
  </expr>
</var_decl>

<var_decl>
  <type>
    <int/>
  </type>
  <id name="v"/>
  <expr>
    <int_lit value="3"/>
  </expr>
</var_decl>

<constraint>
  <pred name="int_lin_eq">
    <expr>
      <array_lit>
        <int_lit value="1"/>
        <int_lit value="1"/>
        <int_lit value="1"/>
      </array_lit>
    </expr>
    <expr>
      <array_lit>
        <int_lit value="1"/>
        <int_lit value="1"/>
        <int_lit value="1"/>
      </array_lit>
    </expr>
    <expr>
      <int_lit value="3"/>
    </expr>
  </pred>
</constraint>

<constraint>
  <pred name="bool2int">
    <expr>
      <array_access>
        <id name="m"/>
        <int_lit value="3"/>
      </array_access>
    </expr>
    <expr>
      <int_lit value="1"/>
    </expr>
  </pred>
</constraint>

<constraint>
  <pred name="bool2int">
    <expr>
      <array_access>
        <id name="m"/>
        <int_lit value="2"/>
      </array_access>
    </expr>
    <expr>
      <int_lit value="1"/>
    </expr>
  </pred>
</constraint>

<constraint>
  <pred name="bool2int">
    <expr>
      <array_access>
        <id name="m"/>
        <int_lit value="1"/>
      </array_access>
    </expr>
    <expr>
      <int_lit value="1"/>
    </expr>
  </pred>
</constraint>

<constraint>
  <pred name="bool_eq">
    <expr>
      <array_access>
        <id name="c"/>
        <int_lit value="1"/>
      </array_access>
    </expr>
    <expr>
      <bool_lit value="false"/>
    </expr>
  </pred>
</constraint>

<constraint>
  <pred name="bool_and">
    <expr>
      <array_access>
        <id name="m"/>
        <int_lit value="1"/>
      </array_access>
    </expr>
    <expr>
      <array_access>
        <id name="m"/>
        <int_lit value="2"/>
      </array_access>
    </expr>
    <expr>
      <array_access>
        <id name="c"/>
        <int_lit value="2"/>
      </array_access>
    </expr>
  </pred>
</constraint>

<constraint>
  <pred name="bool_and">
    <expr>
      <array_access>
        <id name="m"/>
        <int_lit value="1"/>
      </array_access>
    </expr>
    <expr>
      <array_access>
        <id name="m"/>
        <int_lit value="3"/>
      </array_access>
    </expr>
    <expr>
      <array_access>
        <id name="c"/>
        <int_lit value="3"/>
      </array_access>
    </expr>
  </pred>
</constraint>

<constraint>
  <pred name="bool_eq">
    <expr>
      <array_access>
        <id name="c"/>
        <int_lit value="4"/>
      </array_access>
    </expr>
    <expr>
      <bool_lit value="false"/>
    </expr>
  </pred>
</constraint>

<constraint>
  <pred name="bool_eq">
    <expr>
      <array_access>
        <id name="c"/>
        <int_lit value="5"/>
      </array_access>
    </expr>
    <expr>
      <bool_lit value="false"/>
    </expr>
  </pred>
</constraint>

<constraint>
  <pred name="bool_and">
    <expr>
      <array_access>
        <id name="m"/>
        <int_lit value="2"/>
      </array_access>
    </expr>
    <expr>
      <array_access>
        <id name="m"/>
        <int_lit value="3"/>
      </array_access>
    </expr>
    <expr>
      <array_access>
        <id name="c"/>
        <int_lit value="6"/>
      </array_access>
    </expr>
  </pred>
</constraint>

<constraint>
  <pred name="bool_eq">
    <expr>
      <array_access>
        <id name="c"/>
        <int_lit value="7"/>
      </array_access>
    </expr>
    <expr>
      <bool_lit value="false"/>
    </expr>
  </pred>
</constraint>

<constraint>
  <pred name="bool_eq">
    <expr>
      <array_access>
        <id name="c"/>
        <int_lit value="8"/>
      </array_access>
    </expr>
    <expr>
      <bool_lit value="false"/>
    </expr>
  </pred>
</constraint>

<constraint>
  <pred name="bool_eq">
    <expr>
      <array_access>
        <id name="c"/>
        <int_lit value="9"/>
      </array_access>
    </expr>
    <expr>
      <bool_lit value="false"/>
    </expr>
  </pred>
</constraint>

<constraint>
  <pred name="bool2int">
    <expr>
      <array_access>
        <id name="c"/>
        <int_lit value="6"/>
      </array_access>
    </expr>
    <expr>
      <int_lit value="1"/>
    </expr>
  </pred>
</constraint>

<constraint>
  <pred name="bool2int">
    <expr>
      <array_access>
        <id name="c"/>
        <int_lit value="3"/>
      </array_access>
    </expr>
    <expr>
      <int_lit value="1"/>
    </expr>
  </pred>
</constraint>

<constraint>
  <pred name="bool2int">
    <expr>
      <array_access>
        <id name="c"/>
        <int_lit value="2"/>
      </array_access>
    </expr>
    <expr>
      <int_lit value="1"/>
    </expr>
  </pred>
</constraint>

<solve>
  <satisfy/>
</solve>

</flatzinc>

